"","identifier","text","amicus_mori_domus_solere_nunc_ire_supra","pes_nemo_afferre_cocus_fortunare_vocare_metiri","pectus_frons_vultus_paene_crinis_lacrima_ceterus","ab_causa_eumolpus_vultus_temptare_amare_noscere","timere_ascyltos_diligens_tantus_locus_longus_accedere","nox_pater_navis_rapere_intellegere_legere_mittere","licere_deinde_vovere_uter_adhuc_perire_vel","pro_postquam_ante_mare_uti_fidere_fluctus","giton_ecce_pes_mors_navis_iterum_ultra","alter_metiri_aureus_nasci_pendere_argenteus_circare","debere_mutare_sive_parare_carmen_placere_verbum","bellus_arma_liber_noster_loqui_caedere_nescire","tantus_anser_confundere_familia_os_ancilla_effundere","caelus_terra_tellus_vocare_pectus_supra_parere","numquid_sanguis_pro_furere_gladium_vox_damnare"
"906","urn:cts:latinLit:phi0972.phi001:91.2","itare ut experimentum oculus capere convertere ille solvere gaudium vultus et miserare inquit frater ubi arma non esse liber loqui eripere ego latro cruentus et qualibet saevitia paenitentia iudex tu punire serere magnus esse mittere solacium tuus voluntas caedere","0.000985221674876847","0.000985221674876847","0.296551724137931","0.000985221674876847","0.000985221674876847","0.000985221674876847","0.000985221674876847","0.000985221674876847","0.000985221674876847","0.000985221674876847","0.000985221674876847","0.69064039408867","0.000985221674876847","0.000985221674876847","0.000985221674876847"
"907","urn:cts:latinLit:phi0972.phi001:91.3","supprimere ego querella iubere nere quis consilium deprehendere relinquere eumolpo nam in balneare carmen recitare per tenebrosus et sordidus egredi extrahere gitona raptim in hospitium meus pervelle","0.00130718954248366","0.00130718954248366","0.00130718954248366","0.00130718954248366","0.00130718954248366","0.0666666666666667","0.00130718954248366","0.393464052287582","0.00130718954248366","0.00130718954248366","0.524183006535948","0.00130718954248366","0.00130718954248366","0.00130718954248366","0.00130718954248366"
"908","urn:cts:latinLit:phi0972.phi001:91.4","praecludere deinde foris invadere pectus amplexus et perfundere os lacrima vultus meus conterere","0.00194174757281553","0.196116504854369","0.390291262135922","0.00194174757281553","0.00194174757281553","0.00194174757281553","0.390291262135922","0.00194174757281553","0.00194174757281553","0.00194174757281553","0.00194174757281553","0.00194174757281553","0.00194174757281553","0.00194174757281553","0.00194174757281553"
"909","urn:cts:latinLit:phi0972.phi001:91.5","diu vocare neuter invenire nam puer etiam singultus creber amabilis pectus quassare","0.00377358490566038","0.381132075471698","0.569811320754717","0.00377358490566038","0.00377358490566038","0.00377358490566038","0.00377358490566038","0.00377358490566038","0.00377358490566038","0.00377358490566038","0.00377358490566038","0.00377358490566038","0.00377358490566038","0.00377358490566038","0.00377358490566038"
"910","urn:cts:latinLit:phi0972.phi001:91.6","o facinus inquit indignus quis amare tu quivis relinquere et in hic pectus cum vulnus ingens esse cicatrix non esse quis dicere peregrinus amor concessio dignus hic iniuriare esse","0.00150375939849624","0.00150375939849624","0.377443609022556","0.00150375939849624","0.603007518796993","0.00150375939849624","0.00150375939849624","0.00150375939849624","0.00150375939849624","0.00150375939849624","0.00150375939849624","0.00150375939849624","0.00150375939849624","0.00150375939849624","0.00150375939849624"
"911","urn:cts:latinLit:phi0972.phi001:91.7","postquam se amare sentire supercilium altus tollere nec amor arbitrium ad alius iudex deferre sed nillil iam queri nihil iam meminisse sium bonus fidere paenitentia emere","0.00150375939849624","0.00150375939849624","0.00150375939849624","0.00150375939849624","0.00150375939849624","0.302255639097744","0.00150375939849624","0.52781954887218","0.0766917293233083","0.00150375939849624","0.00150375939849624","0.0766917293233083","0.00150375939849624","0.00150375939849624","0.00150375939849624"
"912","urn:cts:latinLit:phi0972.phi001:91.8","hic cum inter gemere lacrima fundere detergere ille pallium vultus et quaesere inquit encolpi fides memoria tuus appellare ego tu relinquere an tu ego prodere equidem fateri et prae ego ferre cum duo armare videre ad fortis confugere","0.000985221674876847","0.000985221674876847","0.444334975369458","0.148768472906404","0.198029556650246","0.000985221674876847","0.000985221674876847","0.000985221674876847","0.198029556650246","0.000985221674876847","0.000985221674876847","0.000985221674876847","0.000985221674876847","0.000985221674876847","0.000985221674876847"
"913","urn:cts:latinLit:phi0972.phi001:91.9","exosculari pectus sapere plenus inicere cervix manus et ut facilis intellegere redire ego in gratia et bonus fidere reviviscere amicitia totus pectus adstrinxi","0.0016260162601626","0.0016260162601626","0.245528455284553","0.0016260162601626","0.0016260162601626","0.164227642276423","0.0016260162601626","0.570731707317073","0.0016260162601626","0.0016260162601626","0.0016260162601626","0.0016260162601626","0.0016260162601626","0.0016260162601626","0.0016260162601626"
"914","urn:cts:latinLit:phi0972.phi001:92.1","etiam plenus nox esse mulier cena mandare curare cum eumolpus ostium pulsare","0.0021505376344086","0.0021505376344086","0.0021505376344086","0.539784946236559","0.0021505376344086","0.432258064516129","0.0021505376344086","0.0021505376344086","0.0021505376344086","0.0021505376344086","0.0021505376344086","0.0021505376344086","0.0021505376344086","0.0021505376344086","0.0021505376344086"
"915","urn:cts:latinLit:phi0972.phi001:92.2","interrogare ego quot esse obiter per rima foris speculari diligens coepere num ascyltos unus venire","0.00240963855421687","0.00240963855421687","0.00240963855421687","0.00240963855421687","0.48433734939759","0.00240963855421687","0.48433734939759","0.00240963855421687","0.00240963855421687","0.00240963855421687","0.00240963855421687","0.00240963855421687","0.00240963855421687","0.00240963855421687","0.00240963855421687"
"916","urn:cts:latinLit:phi0972.phi001:92.3","deinde ut solus hospes videre momentum recipere ille ut se in grabatus reicere videre gitona in conspicere ministrare movere caput et laudare inquit ganymedem oportet hodie bonus esse","0.0016260162601626","0.0016260162601626","0.0016260162601626","0.0016260162601626","0.0016260162601626","0.0016260162601626","0.245528455284553","0.0016260162601626","0.0016260162601626","0.0016260162601626","0.733333333333333","0.0016260162601626","0.0016260162601626","0.0016260162601626","0.0016260162601626"
"917","urn:cts:latinLit:phi0972.phi001:92.4","non delectare ego tam curiosus principium timere nere in contu bernium recipere ascylti parare","0.00273972602739726","0.00273972602739726","0.00273972602739726","0.00273972602739726","0.276712328767123","0.13972602739726","0.00273972602739726","0.00273972602739726","0.00273972602739726","0.00273972602739726","0.276712328767123","0.00273972602739726","0.00273972602739726","0.00273972602739726","0.276712328767123"
"918","urn:cts:latinLit:phi0972.phi001:92.5","instare eumolpus et cum puer ille potio dare malus tu inquit quis balneum totus siccare avidus poculum negare se unquam acidus esse","0.0021505376344086","0.432258064516129","0.0021505376344086","0.0021505376344086","0.0021505376344086","0.0021505376344086","0.217204301075269","0.0021505376344086","0.0021505376344086","0.0021505376344086","0.0021505376344086","0.0021505376344086","0.324731182795699","0.0021505376344086","0.0021505376344086"
"919","urn:cts:latinLit:phi0972.phi001:92.6","nam et dum lavare aere paene vapulare quia conari esse circare solium sedere carmen recitare et postquam de balneare tanquam de theatrum eicere esse circuire omnis angulus coepere et clarus vox encolpion clamitare","0.0557377049180328","0.00109289617486339","0.219672131147541","0.00109289617486339","0.00109289617486339","0.00109289617486339","0.00109289617486339","0.165027322404372","0.00109289617486339","0.165027322404372","0.165027322404372","0.00109289617486339","0.00109289617486339","0.00109289617486339","0.219672131147541"
"920","urn:cts:latinLit:phi0972.phi001:92.7","ex alter pars iuvenis nudus quis vestimentum perdere non parvus clamor indignatio gitona flagitare","0.00273972602739726","0.00273972602739726","0.00273972602739726","0.00273972602739726","0.00273972602739726","0.00273972602739726","0.00273972602739726","0.00273972602739726","0.00273972602739726","0.00273972602739726","0.961643835616438","0.00273972602739726","0.00273972602739726","0.00273972602739726","0.00273972602739726"
"921","urn:cts:latinLit:phi0972.phi001:92.8","et ego quidem puer tanquam insanus imitatio petulans deridere ile autem frequens ingene circumvenire cum plaudere et admiratio timidus","0.00273972602739726","0.13972602739726","0.00273972602739726","0.00273972602739726","0.00273972602739726","0.00273972602739726","0.00273972602739726","0.00273972602739726","0.00273972602739726","0.00273972602739726","0.00273972602739726","0.824657534246575","0.00273972602739726","0.00273972602739726","0.00273972602739726"
"922","urn:cts:latinLit:phi0972.phi001:92.9","habere enim inguen pondus tam grandis ut ipse homo lacinia fascinum credere o iuvenis laboriosus putare ile pridie incipere posterare dies finire","0.0016260162601626","0.0016260162601626","0.0829268292682927","0.0829268292682927","0.245528455284553","0.0829268292682927","0.0016260162601626","0.0016260162601626","0.0016260162601626","0.0016260162601626","0.489430894308943","0.0016260162601626","0.0016260162601626","0.0016260162601626","0.0016260162601626"
"923","urn:cts:latinLit:phi0972.phi001:92.10","itare statim invenire auxilium nescire quis enim eques romanus ut aere infamis suus vestis errare circumdare ac domus abducere credere ut tam magnus fortunare solus uti","0.377443609022556","0.00150375939849624","0.377443609022556","0.00150375939849624","0.00150375939849624","0.00150375939849624","0.00150375939849624","0.00150375939849624","0.00150375939849624","0.00150375939849624","0.0766917293233083","0.00150375939849624","0.00150375939849624","0.00150375939849624","0.15187969924812"
"924","urn:cts:latinLit:phi0972.phi001:92.11","at ego nere meus quidem vestimentum ab officiosus custos recipere niti notor dare tantus maga expedire inguen quis ingenium fricare","0.00194174757281553","0.00194174757281553","0.00194174757281553","0.390291262135922","0.00194174757281553","0.00194174757281553","0.00194174757281553","0.00194174757281553","0.00194174757281553","0.00194174757281553","0.584466019417476","0.00194174757281553","0.00194174757281553","0.00194174757281553","0.00194174757281553"
"925","urn:cts:latinLit:phi0972.phi001:92.12","hic eumolpo dicere mutare ego frequens vultus iniuria scilicet inimicus ego hilaris commodus tristis","0.00194174757281553","0.00194174757281553","0.00194174757281553","0.972815533980583","0.00194174757281553","0.00194174757281553","0.00194174757281553","0.00194174757281553","0.00194174757281553","0.00194174757281553","0.00194174757281553","0.00194174757281553","0.00194174757281553","0.00194174757281553","0.00194174757281553"
"926","urn:cts:latinLit:phi0972.phi001:92.13","utcunque tamen tanquam non agnoscere fabula tacere et cena ordinare explicare","0.00273972602739726","0.00273972602739726","0.00273972602739726","0.00273972602739726","0.276712328767123","0.276712328767123","0.00273972602739726","0.413698630136986","0.00273972602739726","0.00273972602739726","0.00273972602739726","0.00273972602739726","0.00273972602739726","0.00273972602739726","0.00273972602739726"
"927","urn:cts:latinLit:phi0972.phi001:93.1","vilis esse quis licere et animus error intendere iniuriare diligere","0.00317460317460317","0.00317460317460317","0.00317460317460317","0.00317460317460317","0.00317460317460317","0.00317460317460317","0.955555555555555","0.00317460317460317","0.00317460317460317","0.00317460317460317","0.00317460317460317","0.00317460317460317","0.00317460317460317","0.00317460317460317","0.00317460317460317"
"928","urn:cts:latinLit:phi0972.phi001:93.2.1","alere phasiacis petere colchis","0.00869565217391304","0.00869565217391304","0.00869565217391304","0.00869565217391304","0.00869565217391304","0.00869565217391304","0.00869565217391304","0.00869565217391304","0.00869565217391304","0.00869565217391304","0.00869565217391304","0.00869565217391304","0.00869565217391304","0.443478260869565","0.443478260869565"
"929","urn:cts:latinLit:phi0972.phi001:93.2.2","at afrae volucer placere palare","0.00606060606060606","0.00606060606060606","0.00606060606060606","0.00606060606060606","0.00606060606060606","0.00606060606060606","0.00606060606060606","0.00606060606060606","0.00606060606060606","0.00606060606060606","0.00606060606060606","0.00606060606060606","0.00606060606060606","0.915151515151515","0.00606060606060606"
"930","urn:cts:latinLit:phi0972.phi001:93.2.3","quis non esse facilis at albus anser","0.00606060606060606","0.00606060606060606","0.00606060606060606","0.00606060606060606","0.00606060606060606","0.00606060606060606","0.00606060606060606","0.00606060606060606","0.00606060606060606","0.915151515151515","0.00606060606060606","0.00606060606060606","0.00606060606060606","0.00606060606060606","0.00606060606060606"
"931","urn:cts:latinLit:phi0972.phi001:93.2.4","et pingere anas enovata penna","0.0153846153846154","0.0153846153846154","0.0153846153846154","0.0153846153846154","0.0153846153846154","0.0153846153846154","0.0153846153846154","0.0153846153846154","0.0153846153846154","0.0153846153846154","0.0153846153846154","0.0153846153846154","0.784615384615385","0.0153846153846154","0.0153846153846154"
"932","urn:cts:latinLit:phi0972.phi001:93.2.5","plebeius sapere ultra ab os","0.00465116279069767","0.00465116279069767","0.00465116279069767","0.00465116279069767","0.00465116279069767","0.00465116279069767","0.00465116279069767","0.237209302325581","0.702325581395349","0.00465116279069767","0.00465116279069767","0.00465116279069767","0.00465116279069767","0.00465116279069767","0.00465116279069767"
"933","urn:cts:latinLit:phi0972.phi001:93.2.6","attrahere scarus at arare syrtis","0.0153846153846154","0.0153846153846154","0.0153846153846154","0.0153846153846154","0.0153846153846154","0.0153846153846154","0.0153846153846154","0.0153846153846154","0.0153846153846154","0.0153846153846154","0.0153846153846154","0.784615384615385","0.0153846153846154","0.0153846153846154","0.0153846153846154"
"934","urn:cts:latinLit:phi0972.phi001:93.2.7","sium quis naufragium dare probare","0.00869565217391304","0.00869565217391304","0.00869565217391304","0.00869565217391304","0.00869565217391304","0.00869565217391304","0.00869565217391304","0.00869565217391304","0.00869565217391304","0.00869565217391304","0.00869565217391304","0.00869565217391304","0.00869565217391304","0.00869565217391304","0.878260869565217"
"935","urn:cts:latinLit:phi0972.phi001:93.2.8","mullus iam gravis esse amicus vincere","0.00606060606060606","0.00606060606060606","0.00606060606060606","0.00606060606060606","0.00606060606060606","0.00606060606060606","0.00606060606060606","0.00606060606060606","0.915151515151515","0.00606060606060606","0.00606060606060606","0.00606060606060606","0.00606060606060606","0.00606060606060606","0.00606060606060606"
"936","urn:cts:latinLit:phi0972.phi001:93.2.9","uxor rodere cinnamum verare","0.0153846153846154","0.0153846153846154","0.0153846153846154","0.0153846153846154","0.0153846153846154","0.0153846153846154","0.0153846153846154","0.0153846153846154","0.0153846153846154","0.0153846153846154","0.0153846153846154","0.0153846153846154","0.784615384615385","0.0153846153846154","0.0153846153846154"
"937","urn:cts:latinLit:phi0972.phi001:93.2.10","quisquis quaerere bonus videre","0.0666666666666667","0.0666666666666667","0.0666666666666667","0.0666666666666667","0.0666666666666667","0.0666666666666667","0.0666666666666667","0.0666666666666667","0.0666666666666667","0.0666666666666667","0.0666666666666667","0.0666666666666667","0.0666666666666667","0.0666666666666667","0.0666666666666667"
"938","urn:cts:latinLit:phi0972.phi001:93.3","hic esse inquit quis promittere nere quis hodie versus facere per fides saltare ego parcere quis tu nunquam lapidare nam sium aliquis ex is quis in idem synoecium potare nomen poeta olfacere totus concitare vicinia et ego omnis sub idem causa obruere miserare et aut pinacotheca aut balneum cogitare","0.00103626943005181","0.00103626943005181","0.00103626943005181","0.156476683937824","0.00103626943005181","0.00103626943005181","0.519170984455959","0.00103626943005181","0.00103626943005181","0.00103626943005181","0.00103626943005181","0.00103626943005181","0.00103626943005181","0.00103626943005181","0.311917098445596"
"939","urn:cts:latinLit:phi0972.phi001:93.4","sic ego loqui obiurgare giton mitis puer et negare regere facere quis senex conviciari simul oblivisci officium metiri quis humanitas ponere contumelia tollere multus alius moderatio verecundia verbum quis forma is egregius decere","0.00122699386503067","0.123926380368098","0.0625766871165644","0.614723926380368","0.00122699386503067","0.00122699386503067","0.00122699386503067","0.00122699386503067","0.00122699386503067","0.00122699386503067","0.00122699386503067","0.185276073619632","0.00122699386503067","0.00122699386503067","0.00122699386503067"
"940","urn:cts:latinLit:phi0972.phi001:94.1","felix inquit mater tuus quis tu talis parere mactus virtus esse rarus facere miscere cum sapere formare itare nere putare tu tot verbum perdere amator invenire","0.0016260162601626","0.0016260162601626","0.0016260162601626","0.0016260162601626","0.0016260162601626","0.0016260162601626","0.0016260162601626","0.0016260162601626","0.0016260162601626","0.0016260162601626","0.245528455284553","0.0016260162601626","0.0016260162601626","0.733333333333333","0.0016260162601626"
"941","urn:cts:latinLit:phi0972.phi001:94.2","ego laudare tuus carmen implere ego paedagogus et custos etiam quis non iubere sequi nec iniuria encolpius accipere alius amare","0.00240963855421687","0.00240963855421687","0.12289156626506","0.363855421686747","0.00240963855421687","0.00240963855421687","0.00240963855421687","0.00240963855421687","0.00240963855421687","0.00240963855421687","0.48433734939759","0.00240963855421687","0.00240963855421687","0.00240963855421687","0.00240963855421687"
"942","urn:cts:latinLit:phi0972.phi001:94.3","proesse etiam eumolpo miles ille quis ego auferre gladium alioquin quis animus adversus ascylton sumere is in eumolpi sanguis exercere nec fallere hic gitona","0.0013986013986014","0.0013986013986014","0.0013986013986014","0.700699300699301","0.0013986013986014","0.0013986013986014","0.0013986013986014","0.0013986013986014","0.0013986013986014","0.0013986013986014","0.0013986013986014","0.0013986013986014","0.0013986013986014","0.0013986013986014","0.281118881118881"
"943","urn:cts:latinLit:phi0972.phi001:94.4","itare extra cella procedere tanquam aqua petere ira meus prudens absens extinguere","0.0021505376344086","0.0021505376344086","0.0021505376344086","0.0021505376344086","0.539784946236559","0.0021505376344086","0.432258064516129","0.0021505376344086","0.0021505376344086","0.0021505376344086","0.0021505376344086","0.0021505376344086","0.0021505376344086","0.0021505376344086","0.0021505376344086"
"944","urn:cts:latinLit:phi0972.phi001:94.5","paululum ergo intepescere saevitia eumolpe inquit iam malus vel carmen loqui quis eiusmodi tu vovere proponere et ego iracundus esse et tu libidinosus videre quis non convenire hic mos","0.00176991150442478","0.00176991150442478","0.00176991150442478","0.00176991150442478","0.00176991150442478","0.00176991150442478","0.444247787610619","0.0902654867256637","0.00176991150442478","0.00176991150442478","0.444247787610619","0.00176991150442478","0.00176991150442478","0.00176991150442478","0.00176991150442478"
"945","urn:cts:latinLit:phi0972.phi001:94.6","putare igitur ego furiosus esse cedere insania is esse ocior forare exire","0.00377358490566038","0.569811320754717","0.00377358490566038","0.381132075471698","0.00377358490566038","0.00377358490566038","0.00377358490566038","0.00377358490566038","0.00377358490566038","0.00377358490566038","0.00377358490566038","0.00377358490566038","0.00377358490566038","0.00377358490566038","0.00377358490566038"
"946","urn:cts:latinLit:phi0972.phi001:94.7","confundere hic denuntiatio eumolpus non quaerere iracundia causa sed continuare limen egredi adducere repente ostium cella ego nihil talis expectare includere eximere raptim clavare et ad gitona investigare currere","0.00115606936416185","0.00115606936416185","0.00115606936416185","0.00115606936416185","0.00115606936416185","0.00115606936416185","0.521387283236994","0.00115606936416185","0.00115606936416185","0.00115606936416185","0.347976878612717","0.00115606936416185","0.116763005780347","0.00115606936416185","0.00115606936416185"
"947","urn:cts:latinLit:phi0972.phi001:94.8","includere ego suspendium vita finire constituere et iam semicinctium legere stare ad paries sponda vincire cervix nodare condere cum reserare foris intrare eumolpus cum gitone ego a fatalis iam metare revocare ad lux","0.00122699386503067","0.00122699386503067","0.00122699386503067","0.00122699386503067","0.123926380368098","0.00122699386503067","0.369325153374233","0.492024539877301","0.00122699386503067","0.00122699386503067","0.00122699386503067","0.00122699386503067","0.00122699386503067","0.00122699386503067","0.00122699386503067"
"948","urn:cts:latinLit:phi0972.phi001:94.9","giton praecipue ex dolor in rabies efferare tollere clamor ego uter manus impellere praecipitare super legere","0.0021505376344086","0.109677419354839","0.0021505376344086","0.0021505376344086","0.0021505376344086","0.0021505376344086","0.217204301075269","0.0021505376344086","0.647311827956989","0.0021505376344086","0.0021505376344086","0.0021505376344086","0.0021505376344086","0.0021505376344086","0.0021505376344086"
"949","urn:cts:latinLit:phi0972.phi001:94.10","errare inquit encolpi sium putare contingere posse ut ante mori prae coepere in ascylti hospitium gladium quaerere","0.00240963855421687","0.00240963855421687","0.00240963855421687","0.00240963855421687","0.00240963855421687","0.00240963855421687","0.00240963855421687","0.363855421686747","0.00240963855421687","0.00240963855421687","0.00240963855421687","0.00240963855421687","0.00240963855421687","0.00240963855421687","0.604819277108434"
"950","urn:cts:latinLit:phi0972.phi001:94.11","ego sium tu non invenire perire per praeceps esse et ut scire non longus esse quaerere mors spectare invicem quis ego spectare velle","0.00317460317460317","0.00317460317460317","0.00317460317460317","0.638095238095238","0.00317460317460317","0.00317460317460317","0.00317460317460317","0.00317460317460317","0.320634920634921","0.00317460317460317","0.00317460317460317","0.00317460317460317","0.00317460317460317","0.00317460317460317","0.00317460317460317"
"951","urn:cts:latinLit:phi0972.phi001:94.12","hic loqui mercennarius eumolpi novacula rapere et semel iterum cervix percutere ante pes collabi noster","0.0016260162601626","0.0016260162601626","0.164227642276423","0.0016260162601626","0.0016260162601626","0.0016260162601626","0.0016260162601626","0.0016260162601626","0.652032520325203","0.0016260162601626","0.0016260162601626","0.164227642276423","0.0016260162601626","0.0016260162601626","0.0016260162601626"
"952","urn:cts:latinLit:phi0972.phi001:94.13","exclamare ego attonare sequi labi idem ferramentum ad mors via quaerere","0.00273972602739726","0.00273972602739726","0.13972602739726","0.00273972602739726","0.00273972602739726","0.00273972602739726","0.00273972602739726","0.00273972602739726","0.824657534246575","0.00273972602739726","0.00273972602739726","0.00273972602739726","0.00273972602739726","0.00273972602739726","0.00273972602739726"
"953","urn:cts:latinLit:phi0972.phi001:94.14","sed nere giton ullus esse suspicio vulnus laedere nere ego ullus sentire dolor rudis enim novacula et in hic retundere ut puer discere audacia tonsor dare instruere theca","0.0013986013986014","0.0013986013986014","0.351048951048951","0.0013986013986014","0.0013986013986014","0.0013986013986014","0.0013986013986014","0.0013986013986014","0.420979020979021","0.0013986013986014","0.211188811188811","0.0013986013986014","0.0013986013986014","0.0013986013986014","0.0013986013986014"
"954","urn:cts:latinLit:phi0972.phi001:94.15","ideo nec mercennarius ad rapere ferramentum expavescere nec eumolpus interpellare mimicus mors","0.0021505376344086","0.0021505376344086","0.109677419354839","0.0021505376344086","0.0021505376344086","0.0021505376344086","0.0021505376344086","0.0021505376344086","0.86236559139785","0.0021505376344086","0.0021505376344086","0.0021505376344086","0.0021505376344086","0.0021505376344086","0.0021505376344086"
"955","urn:cts:latinLit:phi0972.phi001:95.1","dum hic fabula inter amare ludere deversitor cum pars cenula intervenire contemplare foedus volutatio iacere","0.00273972602739726","0.00273972602739726","0.00273972602739726","0.00273972602739726","0.00273972602739726","0.00273972602739726","0.413698630136986","0.413698630136986","0.00273972602739726","0.00273972602739726","0.00273972602739726","0.13972602739726","0.00273972602739726","0.00273972602739726","0.00273972602739726"
"956","urn:cts:latinLit:phi0972.phi001:95.2","rogare inquit ebrius esse an fugitivus an uter quis autem grabatus ille erigere aut quis se velle tam furtivus molitio","0.00240963855421687","0.00240963855421687","0.00240963855421687","0.00240963855421687","0.00240963855421687","0.00240963855421687","0.604819277108434","0.00240963855421687","0.00240963855421687","0.00240963855421687","0.363855421686747","0.00240963855421687","0.00240963855421687","0.00240963855421687","0.00240963855421687"
